{"attack_count":31,"attacks":[{"attack":"undeclaredBaseline","class_id":"class-0","separators":["selfReport"]},{"attack":"history2","class_id":"class-8","separators":["selfReport","fullExecutorLog","targetedReceipt_executeHiddenSweep"]},{"attack":"history3","class_id":"class-9","separators":["selfReport","fullExecutorLog","targetedReceipt_readFutureData"]},{"attack":"history4","class_id":"class-4","separators":["selfReport","targetedReceipt_tamperCostModel"]},{"attack":"hiddenSweep","class_id":"class-2","separators":["fullExecutorLog","targetedReceipt_executeHiddenSweep"]},{"attack":"futureLeak","class_id":"class-3","separators":["fullExecutorLog","targetedReceipt_readFutureData"]},{"attack":"costModelTampering","class_id":"class-1","separators":["targetedReceipt_tamperCostModel"]},{"attack":"history8","class_id":"class-11","separators":["selfReport","fullExecutorLog","targetedReceipt_executeHiddenSweep","targetedReceipt_readFutureData"]},{"attack":"history9","class_id":"class-12","separators":["selfReport","fullExecutorLog","targetedReceipt_executeHiddenSweep","targetedReceipt_tamperCostModel"]},{"attack":"history10","class_id":"class-11","separators":["selfReport","fullExecutorLog","targetedReceipt_executeHiddenSweep","targetedReceipt_readFutureData"]},{"attack":"history11","class_id":"class-13","separators":["selfReport","fullExecutorLog","targetedReceipt_readFutureData","targetedReceipt_tamperCostModel"]},{"attack":"history12","class_id":"class-12","separators":["selfReport","fullExecutorLog","targetedReceipt_executeHiddenSweep","targetedReceipt_tamperCostModel"]},{"attack":"history13","class_id":"class-13","separators":["selfReport","fullExecutorLog","targetedReceipt_readFutureData","targetedReceipt_tamperCostModel"]},{"attack":"dualAttack","class_id":"class-5","separators":["fullExecutorLog","targetedReceipt_executeHiddenSweep","targetedReceipt_readFutureData"]},{"attack":"history15","class_id":"class-6","separators":["fullExecutorLog","targetedReceipt_executeHiddenSweep","targetedReceipt_tamperCostModel"]},{"attack":"history16","class_id":"class-5","separators":["fullExecutorLog","targetedReceipt_executeHiddenSweep","targetedReceipt_readFutureData"]},{"attack":"history17","class_id":"class-7","separators":["fullExecutorLog","targetedReceipt_readFutureData","targetedReceipt_tamperCostModel"]},{"attack":"history18","class_id":"class-6","separators":["fullExecutorLog","targetedReceipt_executeHiddenSweep","targetedReceipt_tamperCostModel"]},{"attack":"history19","class_id":"class-7","separators":["fullExecutorLog","targetedReceipt_readFutureData","targetedReceipt_tamperCostModel"]},{"attack":"history20","class_id":"class-14","separators":["selfReport","fullExecutorLog","targetedReceipt_executeHiddenSweep","targetedReceipt_readFutureData","targetedReceipt_tamperCostModel"]},{"attack":"history21","class_id":"class-14","separators":["selfReport","fullExecutorLog","targetedReceipt_executeHiddenSweep","targetedReceipt_readFutureData","targetedReceipt_tamperCostModel"]},{"attack":"history22","class_id":"class-14","separators":["selfReport","fullExecutorLog","targetedReceipt_executeHiddenSweep","targetedReceipt_readFutureData","targetedReceipt_tamperCostModel"]},{"attack":"history23","class_id":"class-14","separators":["selfReport","fullExecutorLog","targetedReceipt_executeHiddenSweep","targetedReceipt_readFutureData","targetedReceipt_tamperCostModel"]},{"attack":"history24","class_id":"class-14","separators":["selfReport","fullExecutorLog","targetedReceipt_executeHiddenSweep","targetedReceipt_readFutureData","targetedReceipt_tamperCostModel"]},{"attack":"history25","class_id":"class-14","separators":["selfReport","fullExecutorLog","targetedReceipt_executeHiddenSweep","targetedReceipt_readFutureData","targetedReceipt_tamperCostModel"]},{"attack":"history26","class_id":"class-10","separators":["fullExecutorLog","targetedReceipt_executeHiddenSweep","targetedReceipt_readFutureData","targetedReceipt_tamperCostModel"]},{"attack":"history27","class_id":"class-10","separators":["fullExecutorLog","targetedReceipt_executeHiddenSweep","targetedReceipt_readFutureData","targetedReceipt_tamperCostModel"]},{"attack":"history28","class_id":"class-10","separators":["fullExecutorLog","targetedReceipt_executeHiddenSweep","targetedReceipt_readFutureData","targetedReceipt_tamperCostModel"]},{"attack":"history29","class_id":"class-10","separators":["fullExecutorLog","targetedReceipt_executeHiddenSweep","targetedReceipt_readFutureData","targetedReceipt_tamperCostModel"]},{"attack":"history30","class_id":"class-10","separators":["fullExecutorLog","targetedReceipt_executeHiddenSweep","targetedReceipt_readFutureData","targetedReceipt_tamperCostModel"]},{"attack":"history31","class_id":"class-10","separators":["fullExecutorLog","targetedReceipt_executeHiddenSweep","targetedReceipt_readFutureData","targetedReceipt_tamperCostModel"]}],"basis_channels":["selfReport","targetedReceipt_executeHiddenSweep","targetedReceipt_readFutureData"],"candidate_attacks":["costModelTampering","history16"],"candidate_novelty":[{"attack":"costModelTampering","basis_covered":false,"class_id":"class-1","classification":"new_observation_boundary","equivalent_known_attacks":[],"exact_signature_novel":true,"separators":["targetedReceipt_tamperCostModel"],"unique_separator":true,"unseen_separators":["targetedReceipt_tamperCostModel"]},{"attack":"history16","basis_covered":true,"class_id":"class-5","classification":"existing_class","equivalent_known_attacks":["dualAttack"],"exact_signature_novel":false,"separators":["fullExecutorLog","targetedReceipt_executeHiddenSweep","targetedReceipt_readFutureData"],"unique_separator":false,"unseen_separators":[]}],"canonical_format":"lfv-canonical-json-v1","class_count":15,"equivalence_classes":[{"class_id":"class-0","members":["undeclaredBaseline"],"separators":["selfReport"],"unique_separator":true},{"class_id":"class-1","members":["costModelTampering"],"separators":["targetedReceipt_tamperCostModel"],"unique_separator":true},{"class_id":"class-2","members":["hiddenSweep"],"separators":["fullExecutorLog","targetedReceipt_executeHiddenSweep"],"unique_separator":false},{"class_id":"class-3","members":["futureLeak"],"separators":["fullExecutorLog","targetedReceipt_readFutureData"],"unique_separator":false},{"class_id":"class-4","members":["history4"],"separators":["selfReport","targetedReceipt_tamperCostModel"],"unique_separator":false},{"class_id":"class-5","members":["dualAttack","history16"],"separators":["fullExecutorLog","targetedReceipt_executeHiddenSweep","targetedReceipt_readFutureData"],"unique_separator":false},{"class_id":"class-6","members":["history15","history18"],"separators":["fullExecutorLog","targetedReceipt_executeHiddenSweep","targetedReceipt_tamperCostModel"],"unique_separator":false},{"class_id":"class-7","members":["history17","history19"],"separators":["fullExecutorLog","targetedReceipt_readFutureData","targetedReceipt_tamperCostModel"],"unique_separator":false},{"class_id":"class-8","members":["history2"],"separators":["selfReport","fullExecutorLog","targetedReceipt_executeHiddenSweep"],"unique_separator":false},{"class_id":"class-9","members":["history3"],"separators":["selfReport","fullExecutorLog","targetedReceipt_readFutureData"],"unique_separator":false},{"class_id":"class-10","members":["history26","history27","history28","history29","history30","history31"],"separators":["fullExecutorLog","targetedReceipt_executeHiddenSweep","targetedReceipt_readFutureData","targetedReceipt_tamperCostModel"],"unique_separator":false},{"class_id":"class-11","members":["history8","history10"],"separators":["selfReport","fullExecutorLog","targetedReceipt_executeHiddenSweep","targetedReceipt_readFutureData"],"unique_separator":false},{"class_id":"class-12","members":["history9","history12"],"separators":["selfReport","fullExecutorLog","targetedReceipt_executeHiddenSweep","targetedReceipt_tamperCostModel"],"unique_separator":false},{"class_id":"class-13","members":["history11","history13"],"separators":["selfReport","fullExecutorLog","targetedReceipt_readFutureData","targetedReceipt_tamperCostModel"],"unique_separator":false},{"class_id":"class-14","members":["history20","history21","history22","history23","history24","history25"],"separators":["selfReport","fullExecutorLog","targetedReceipt_executeHiddenSweep","targetedReceipt_readFutureData","targetedReceipt_tamperCostModel"],"unique_separator":false}],"known_attacks":["undeclaredBaseline","hiddenSweep","futureLeak","dualAttack"],"model_digest":{"algorithm":"sha256","digest":"56189d45c146251edea8925a76bd9d70eb3098d35f31eeb2aeecb2654423f658","schema_id":"lfv-evidence-taxonomy-model-digest-v1"},"name":"cost-model-tampering-epistemic-novelty","reference_history":"honest","report_digest":{"algorithm":"sha256","digest":"f2c0e696eba0b9503ee8d5d037a6cbc299dc4ee6aea0590a8b44a2db98c9c010","schema_id":"lfv-evidence-taxonomy-report-digest-v1"},"schema_version":"lfv-evidence-taxonomy-report-v1","spec_digest":{"algorithm":"sha256","digest":"f294ae4773c12612195ffd3b7fa9a9c7f01d8a9586229949ce76531fae791dd3","schema_id":"lfv-evidence-taxonomy-spec-digest-v1"},"strict_signature_subsumption":[{"broader_class":"class-4","stricter_class":"class-0"},{"broader_class":"class-8","stricter_class":"class-0"},{"broader_class":"class-9","stricter_class":"class-0"},{"broader_class":"class-11","stricter_class":"class-0"},{"broader_class":"class-12","stricter_class":"class-0"},{"broader_class":"class-13","stricter_class":"class-0"},{"broader_class":"class-14","stricter_class":"class-0"},{"broader_class":"class-4","stricter_class":"class-1"},{"broader_class":"class-6","stricter_class":"class-1"},{"broader_class":"class-7","stricter_class":"class-1"},{"broader_class":"class-10","stricter_class":"class-1"},{"broader_class":"class-12","stricter_class":"class-1"},{"broader_class":"class-13","stricter_class":"class-1"},{"broader_class":"class-14","stricter_class":"class-1"},{"broader_class":"class-5","s